<!ENTITY % person.basecontent "name, vorname, adresse, geburtsdatum, ahv-nummer">
<!ENTITY % person.baseattr "geschlecht (m|w) #REQUIRED">

<!ELEMENT schule (modulliste, personen)>

<!ELEMENT modulliste (modul+)>

<!ELEMENT modul (modul-name, studiengang+)>
<!ATTLIST modul kuerzel CDATA #REQUIRED>
<!ELEMENT modul-name (#PCDATA)>
<!ELEMENT studiengang (#PCDATA)>

<!ELEMENT personen (dozent*, student*)>
<!ELEMENT dozent (%person.basecontent;, unterrichtet*)>
<!ATTLIST dozent %person.baseattr;>
<!ELEMENT student (%person.basecontent;, pruefungsnote*)>
<!ATTLIST student %person.baseattr;>

<!ELEMENT name (#PCDATA)>
<!ELEMENT vorname (#PCDATA)>
<!ELEMENT adresse (#PCDATA)>
<!ELEMENT geburtsdatum (#PCDATA)>
<!ELEMENT ahv-nummer (#PCDATA)>

<!ELEMENT unterrichtet (#PCDATA)>

<!ELEMENT pruefungsnote (#PCDATA)>
<!ATTLIST pruefungsnote modul CDATA #REQUIRED
                        datum NMTOKEN #REQUIRED>



<!--

Liste der Module
Jedes Modul besitzt einen Namen und ein Kürzel
Jedes Modul ist einem oder mehreren Studiengängen zugeordnet.
Listen der Studierenden und Dozierenden
Für Studierende und Dozierende sollten Name, Vorname, Adresse, Geburtsdatum, Geschlecht sowie AHV-Nummer erfasst werden.
Für die Dozierenden ist erfasst, welche Module sie unterrichten.
Für Studierende sind alle abgelegten Modulprüfungen mit Note und Datum erfasst
-->
